{
  "moduleCounter": 7,
  "modulesWithImageCounter": 3,
  "modulesWithIssuesCounter": 6,
  "issueCounter": 9,
  "lastUpdate": "2025-09-28T00:00:00.000Z",
  "repositoryHoster": {
    "github": 7
  },
  "maintainer": {
    "CFenner": 1,
    "ItayXD": 1,
    "j-hiller": 1,
    "maxbethge": 1,
    "rubinho101": 1,
    "trumpetx": 1,
    "Unclearogre": 1
  }
}
